id,notification,default_sms_msg,default_whatsapp_msg,default_email_msg
1,Client Enrollment,"Welcome to {Service Name}! We're excited to have you, {Client Name}. Let's get started.","Welcome aboard! Your enrollment is complete. Reach out if you need assistance, {Client Name}.","Dear {Client Name}, thank you for enrolling with {Service Name}. We're here to help you succeed."
2,Service Booking,Your booking for {Service Name} on {Date} at {Time} is confirmed. See you soon!,Hello! Your booking for {Service Name} is confirmed for {Date} at {Time}.,"Dear {Client Name}, your service booking for {Service Name} is scheduled for {Date} at {Time}. Thank you!"
3,Appointment Reminders,Reminder: Your appointment is scheduled for {Date} at {Time}. Please arrive on time.,"Hi {Client Name}, just a reminder about your appointment on {Date} at {Time}.","Dear {Client Name}, this is a reminder for your appointment scheduled for {Date} at {Time}."
4,Laboratory Result Completion,Your lab results are available. Please check your portal or contact us for details.,"Hi {Client Name}, your lab results are ready. Access them via {link} or contact us.","Dear {Client Name}, your lab results are finalized. Log in to your portal or contact us to review them."
5,Payment Confirmation,Payment of {Amount} for {Service Name} has been received. Thank you!,We've received your payment of {Amount} for {Service Name}. Thank you!,"Dear {Client Name}, your payment of {Amount} for {Service Name} is processed. Thank you for your business."
6,Debt Reminders,Reminder: You have an outstanding balance of {Amount}. Please clear it by {Due Date}.,"Hi {Client Name}, you have an overdue balance of {Amount}. Please pay by {Due Date}.","Dear {Client Name}, an outstanding balance of {Amount} is due. Please pay by {Due Date} to avoid service disruption."
7,Privacy Update,We've updated our privacy policy. Review it here: {link}.,"Hi {Client Name}, updates were made to our privacy policy. Read details here: {link}.","Dear {Client Name}, we've updated our privacy policy. Review changes here: {link}. Reach out with questions."
8,Account Information Update,Your account information has been updated successfully. Contact us if this wasn't you.,"Hi {Client Name}, your account details were updated. Notify us if this wasn't you.","Dear {Client Name}, your account info was updated. If unauthorized, contact us immediately."
9,Account Authentication,Your authentication code is {Code}. It expires in {Time}.,"Hi {Client Name}, your authentication code is {Code}. Use it within {Time}.","Dear {Client Name}, your authentication code is {Code}. If not requested, contact us."